{
  "schemaVersion": 1,
  "cards": {
    "card-001": {
      "id": "card-001",
      "name": "Demo Market",
      "code": "4006381333931",
      "format": "EAN13",
      "color": "#42A5F5",
      "sortIndex": 0,
      "createdAt": "2026-06-17T09:30:00.000Z",
      "updatedAt": "2026-06-17T09:30:00.000Z"
    }
  },
  "settings": {
    "themeMode": "system",
    "sortMode": "manual",
    "language": "system"
  },
  "tutorial": {
    "enabled": true,
    "seenSteps": {}
  }
}
